{
  "id": "1a2b3c4d-0000-4000-8000-000000000001",
  "assignment_uri": "https://grip.opdrachtgever.example/id/opdracht/3f2a8c54-6d1b-4f0e-9a77-1c2b3d4e5f60",
  "name": "Opdracht Alfa",
  "description": "Fictieve aanvraag.",
  "client": {
    "tooi_uri": "https://identifier.overheid.nl/tooi/id/ministerie/mnre0000",
    "name": "Voorbeeldministerie",
    "unit_key": "directie-voorbeeld",
    "instance_uri": "https://grip.opdrachtgever.example"
  },
  "contractor": {
    "tooi_uri": "https://identifier.overheid.nl/tooi/id/oorg/oorg00000",
    "name": "Voorbeelddienst",
    "unit_key": "voorbeeldgilde",
    "instance_uri": "https://grip.opdrachtnemer.example"
  },
  "context_refs": [
    "https://corpus.voorbeeldministerie.example/id/node/0b6f1c1e-5a0e-4a53-9a43-0d3e1d6b2a03",
    "https://corpus.anderministerie.example/id/node/7c1d2f3a-1111-4222-8333-444455556666"
  ],
  "desired_period": {
    "start_date": "2026-07-01",
    "end_date": "2027-06-30"
  },
  "budget_indication": {
    "amount_cents": 125000000,
    "currency": "EUR"
  },
  "parent_assignment_uri": null,
  "contact_email": "opdrachten@opdrachtgever.example",
  "sent_at": "2026-05-20T09:15:00+02:00"
}
