{
  "id": "1a2b3c4d-0000-4000-8000-000000000003",
  "assignment_uri": "https://grip.opdrachtgever.example/id/opdracht/bbbbbbbb-0000-4000-8000-000000000001",
  "name": "Verkenning Gamma",
  "client": {
    "tooi_uri": "https://identifier.overheid.nl/tooi/id/ministerie/mnre0000",
    "name": "Voorbeeldministerie",
    "unit_key": "directie-voorbeeld",
    "instance_uri": "https://grip.opdrachtgever.example"
  },
  "contractor": {
    "tooi_uri": "https://identifier.overheid.nl/tooi/id/oorg/oorg00000",
    "name": "Voorbeelddienst",
    "unit_key": "voorbeeldgilde",
    "instance_uri": "https://grip.opdrachtnemer.example"
  },
  "context_refs": [],
  "sent_at": "2026-05-21T09:15:00+02:00"
}
